"Slug","Section","Title","Description","Category","Author","Traduction","Date","Image","Image:alt","Latest","Text","Poem","Title 1","Poem 1","Title 2","Poem 2","Title 3","Poem 3","Audio File","Audio Quote"
"vivaldi-my-dad-and-i","Arts - English","Vivaldi, my Dad, and I","With his handmade amplifiers and speakers, my father's passion for sound filled our home with music.","MUSIC","Shweta Menon","/entries/articles/vivaldi-mon-père-et-moi","2026-03-03T00:00:00.000Z","https://framerusercontent.com/images/dqYpcO7PwY8UdOQqBSZBZgl2CXA.png","","NO","<p dir=""auto"">When people say that classical music can sound like rain, they are usually thinking of Antonio Vivaldi. His music does more than play notes. It brings entire seasons to life.</p><p dir=""auto"">My father's love for sound was immense and deep. His devotion to his Hi-fi system, and his urge to build his own amplifiers and speakers using his engineering skills, made music something physical in our home — something we felt in our bodies, in the vibration of the room, in the way the air itself seemed to move.</p><p dir=""auto"">My entire childhood was shaped by both Western classical and Indian classical music. I remember my granny insisting that I listen to Indian classical, taking me for Karnatic music classes to learn to sing. I was barely four years old. I would sit there in a group with older children, trying to sing or pretending to sing, hoping the teacher would never notice that I was lip syncing.</p><p dir=""auto"">Over time, Western classical became something my dad and I especially shared. It became our quiet space, our common ground. Through composers like Mozart, Vivaldi, and Bach, we built a bond that did not need many words.</p><p dir=""auto"">When you close your eyes and truly listen, you are no longer in the room. You are somewhere else entirely. In The Four Seasons, soft rainfall and slow moving streams feel gentle and alive, almost tender. Then, without warning, the mood shifts. The rain grows heavier. Thunder crashes.</p><p dir=""auto"">What always amazed me, even as a child, was how real it felt. Vivaldi composed this music in the early 1700s, long before recordings or modern technology. And yet he captured the feeling of nature with astonishing precision. With nothing but instruments and imagination, he recreated rain, storms, wind, and calm in a way that still feels alive centuries later.</p><p dir=""auto"">I understand now that what my dad gave me was not just a love for classical music. He gave me a way to feel close to him, no matter where we are. Vivaldi is not just a composer in my life. He is part of how my father and I stay connected.</p>","","","","","","","","",""
"the-dissonance-of-jazz","Arts - English","The Dissonance of Jazz","The first time I listened to jazz I was thirteen years old and I did not understand anything.","MUSIC","Raphaël Touzelet","/entries/articles/apprivoiser-le-jazz","2026-02-28T00:00:00.000Z","https://framerusercontent.com/images/y4eUCGytyq1LRR0QYwEh34dEUs8.png","","English","<p dir=""auto"">The first time I listened to jazz I was thirteen years old and I did not understand anything. <em>Kind of Blue</em> was the first album I played. Nothing was clear, the rare passages that harmonically conformed to my habits were quickly overtaken by some unpredictable dissonance. All of it formed an indecipherable chaos. I was definitively impervious to this music that enjoys such great prestige.</p><p dir=""auto"">I was impervious to jazz, too bad. I thought about it for days. Fragments kept coming back to me: the opening double bass notes of <em>Flamenco Sketches</em> or the first three chords of <em>Blue in Green</em>. Until one day I decided, with genuine desire, to play the album again. For eight years now I've been listening to this album every month.</p><p dir=""auto"">Music is made of notes, notes are sounds, sounds are vibrations in the air. The quantity of air vibration emitted by a note is its frequency. Each sound emits a fundamental frequency and a cluster of other frequencies that are multiples of the fundamental. A note alone means nothing — it takes on meaning in context.</p><p dir=""auto"">For some impenetrable reason, the combination of several notes will sound more or less pleasing. G and C sound perfectly consonant and give a sensation of satisfaction. Conversely, C and C# sound very dissonant, and create a sensation of tension. Music could be summarized thus: the art of producing and resolving tensions.</p><p dir=""auto"">The freedom of jazz is to regularly step outside the established scale. This is what we call borrowing. For a brief instant, the listener perceives a dissonance that creates tension, stress. This tension dissipates when the musician resolves it, returning to a stable scale through a satisfying interval.</p><p dir=""auto"">The notion of a wrong note extinguishes itself: everything is just a question of context. It's this excitement that creates the thrill of this music. Contemporary pop music is, for the most part, strictly diatonic. Listening to jazz is a listening that demands surrender, as before a painting.</p>","","","","","","","","",""
"inherent-vice-en","Arts - English","Inherent Vice","This film is a dazed, hungover walk down a Californian beach during the care-free hippie era of the 1970s.","FILM REVIEW","Augustin Dubois","/entries/articles/inherent-vice-fr","2026-02-21T00:00:00.000Z","https://framerusercontent.com/images/KmSmhSBu0zvlVSGTwYi142FK8.png","","NO","<p dir=""auto"">This film is a dazed, hungover walk down a Californian beach during the care-free hippie era of the 1970s, a place that is in reality so distant and unknown to me, but equally a place that feels like home after watching the film. An ambience of warmth and tranquility quite literally oozes from the screen with the vibrant and psychedelic colors, the relaxing background score, the spot-on costumes or the soothing voice of the anonymous narrator.</p><p dir=""auto"">The film starts by exposing an intriguing plot line, but as the plot progresses and as new characters are constantly unveiled, you start to understand that maybe the film leans more towards prioritizing character and thematic development over conventional narration.</p><p dir=""auto"">The character of Larry 'Doc' Sportello, played by Joaquin Phoenix, is introduced as an unstable, stoned, wrecked detective, trapped between alleged hallucinations and reality. Yet throughout the film his behavior and personality fluctuate between that of a junkie and that of an elegant, well-dressed detective, just to return back to his original hippie lifestyle at the end.</p><p dir=""auto"">This pattern is found numerous times in this film, perhaps to show, more globally, the difficulty of a change of era, a change of lifestyle. The slow rise of modern America in the 1970s, in contrast with the periods of protests and political movements of the 1960s sought after by the hippies shown in Inherent Vice. Doc's constant rebellion against authority, independent lifestyle and ostracism from society is the fight of a generation, the desperate clinging onto a golden era that is being progressively erased by modernity.</p>","","","","","","","","",""
"borsalino-mon-voisin-et-ma-casquette","Arts - French","Borsalino, mon voisin et ma casquette","C'est une simple casquette. Mais pas n'importe laquelle. Sur le côté, elle a un sigle, composé à l'aide d'une barrette en métal doré : Borsalino.","CHRONIQUES","Fabrice d'Almeida","","2026-05-14T00:00:00.000Z","https://framerusercontent.com/images/slvU2pNlkWB8k6fIz8dtpFEfzcg.png","","French","<p dir=""ltr"">C'est une simple casquette. Mais pas n'importe laquelle. Sur le côté, elle a un sigle, composé à l'aide d'une barrette en métal doré : Borsalino. La légendaire marque de chapeau s'est diversifiée et fait maintenant des casquettes de baseball dont la coupe est très soignée. Je la vois dans la vitrine d'une échoppe avec curiosité.</p><p dir=""ltr"">Borsalino dans mon enfance était un nom qui comptait. Un film l'avait fait entrer dans la légende. Borsalino, sorti en 1970, était un événement car il rassemblait deux stars du cinéma français, Jean-Paul Belmondo et Alain Delon. L'histoire racontait l'ascension de deux gangsters dans le Marseille des années 1920. Je comprenais mal le titre et posais la question à mon voisin d'en face, M. Guenassia. C'est un grand bonhomme, originaire de Tunisie, qui portait, à l'occasion, un beau chapeau. Il avait la réponse. « Ce sont leurs chapeaux, ils sont caractéristiques d'une marque italienne : Borsalino, justement ».</p><p dir=""ltr"">J'allais sur les grands boulevards. À l'époque, il y avait plusieurs magasins de couvre-chef. J'entrais dans l'un d'eux et je demandais s'ils avaient des Borsalinos. J'en essayais plusieurs. Pas du tout bien pour ma tête. Aucun ne m'a jamais été : trop larges, trop sérieux, trop Monsieur. Mais je voyais bien qu'ils étaient d'une qualité excellente.</p><p dir=""ltr"">Quand j'ai finalement mis la casquette sur ma tête, j'ai senti qu'elle était à la bonne taille. Un sentiment de bien-être m'a envahi. Ma compagne m'a regardé et m'a dit : « Superbe ! Je te l'offre ». Depuis j'ai du mal à la retirer. J'ai l'impression d'être un gangster des années 1930, avec ma coiffe des années 2020.</p>","","","","","","","","",""
"sur-nietzsche-chez-marty-mauser-et-alysa-liu","Arts - French","Sur Nietzsche chez Marty Mauser et Alysa Liu","Deux personnages dont l'enthousiasme irrationnel doublé d'une persistance désinvolte font se sentir plus vivant que jamais.","ARTS CROISÉS","Adrien Bréval","/entries/articles/nietzsche-through-marty-mauser-and-alysa-liu","2026-04-27T00:00:00.000Z","https://framerusercontent.com/images/qzJh8CLfgNMrxFIASbLEpx0E9o.png","","NO","<p dir=""ltr"">La vie ordinaire prend peu ou prou toujours la même trame : une monotonie agréable, rythmée par les contraintes et ponctuée par les peines. Il arrive parfois que frappe un éclair. Un choc incandescent qui vous saisit, qui vous promet que la vie vous réserve plus que cette agonie langoureuse.</p><p dir=""ltr"">Dans <em>Le Gai Savoir</em>, Nietzsche écrit que le bonheur est dans la lutte. Quand on lit le philosophe allemand, il n'est pas rare de se sentir appelé à faire de grandes choses. Une étincelle danse alors au fond de notre ventre : l'appel de l'excellence. <em>« L'ultime noblesse, c'est l'exception. »</em></p><p dir=""ltr"">Un vendredi soir, je suis allé voir <em>Marty Supreme</em>. Le film le plus nietzschéen que j'aie vu. Marty Mauser : un gars arrogant et amoral, dévoré par un rêve pur comme un diamant. Je n'ai jamais vu l'ambition démesurée, l'optimisme fou et irréaliste aussi bien incarnés dans un long métrage. Le long métrage de Josh Safdie est une invitation à jouir de la vie dans toutes ses expériences contraires, tout comme l'<em>Amor fati</em> de Nietzsche.</p><p dir=""ltr"">Quelques jours ont passé. J'ai allumé la télé pour regarder les Jeux olympiques. C'est à cet instant que j'ai découvert qui était Alysa Liu. Sa danse sur la glace était gracieuse, puissante, et se déployait sans effort, avec irrévérence, le tout ponctué par un <em>« That's what I'm fucking talking about! »</em>.</p><p dir=""ltr"">Le spectacle de ces deux êtres rallume quelque chose que tout semble conspirer à éteindre. Cette force qui meut et qui guide pour peindre de grandes toiles, pour lutter contre le quotidien morne.</p>","","","","","","","","",""
"apprivoiser-le-jazz","Arts - French","Apprivoiser le Jazz","La première fois que j'ai écouté du jazz, j'avais treize ans et je n'ai rien compris.","MUSIQUE","Raphaël Touzelet","/entries/articles/the-dissonance-of-jazz","2026-02-28T00:00:00.000Z","https://framerusercontent.com/images/y4eUCGytyq1LRR0QYwEh34dEUs8.png","","French","<p dir=""auto"">La première fois que j'ai écouté du jazz, j'avais treize ans et je n'ai rien compris. <em>Kind of Blue</em> est le premier album du genre que j'ai lancé. Rien n'était clair, les rares passages harmoniquement conformes à mes habitudes étaient vite rattrapés par une dissonance imprévisible. J'y ai repensé pendant des jours. Des fragments me revenaient : les premières notes de contrebasse de <em>Flamenco Sketches</em> ou les trois premiers accords de <em>Blue in green</em>. Jusqu'à ce qu'un jour je décide avec une sincère envie, de relancer l'album. Depuis huit ans, je réécoute cet album tous les mois.</p><p dir=""auto"">La musique est faite de notes, les notes sont des sons, les sons sont des vibrations de l'air. La quantité de vibration de l'air émis par une note est sa fréquence, exprimée en Hz. Chaque son émet une fréquence fondamentale et un paquet d'autres fréquences qui sont des multiples de la fondamentale. Une note seule ne veut rien dire, au sens qu'elle ne transmet pas d'émotion particulière. Elle prend sens dans un contexte.</p><p dir=""auto"">Pour une raison impénétrable, la combinaison de plusieurs notes sonnera plus ou moins agréable. Le Sol et le Do sonnent parfaitement consonant et donnent une sensation de satisfaction. A l'inverse Do et Do# sonnent très dissonants, et créent une sensation de tension. La musique pourrait être résumée ainsi : l'art de produire et résoudre des tensions.</p><p dir=""auto"">La liberté du jazz, c'est de sortir régulièrement de la gamme fixée, c'est ce qu'on appelle des emprunts. Pendant un bref instant, l'auditeur perçoit une dissonance qui crée une tension, un stress. Cette tension vient s'évanouir quand le musicien la résout. La notion de fausse note s'éteint, tout n'est qu'une question de contexte.</p><p dir=""auto"">C'est cette excitation qui fait le frisson de cette musique. La musique pop contemporaine est en majorité, strictement diatonique. C'est-à-dire qu'elle se refuse à sortir de la gamme, même un bref instant. L'écoute du jazz est une écoute qui demande de s'abandonner, comme devant un tableau.</p>","","","","","","","","",""
"mektoub-my-love-fr","Arts - French","Mektoub, My Love","Ces trois heures ont tout d'un long mois d'août, où tout est si lent mais pourtant où tout passe si vite.","CRITIQUE DE FILM","Raphaël Touzelet","/entries/articles/mektoub-my-love-en","2026-03-08T00:00:00.000Z","https://framerusercontent.com/images/TRm6FXxT93fvqSiHDv22ooCFWoY.png","","NO","<p dir=""auto"">Sublime, tout est sublime. Dès la première scène j'étais happé : cette conversation entre Amin et Ophélie, et en une scène Kechiche annonce tout son talent pour ce qui va constituer la majorité du film : les dialogues. On sent que rien n'est écrit, les personnages parlent de banalités, ils comblent le vide, il y a des silences gênants, des répétitions. C'est une des trois facettes du film : le réalisme.</p><p dir=""auto"">Je ne sais pas comment c'est possible d'obtenir un jeu aussi naturel. Le timing des rires, des sourires, des répliques ne peut pas être calculé ou répété. Tout est pure improvisation, pure vie. Kechiche a choisi une trentaine de personnes pour passer des vacances ensemble, et il en fait un film de purs moments vrais.</p><p dir=""auto"">J'ai beaucoup apprécié la façon que le film a de donner une vraie importance à chaque personnage. La sensualité passe par les regards, il suffit d'un regard un peu insistant entre Ophélie et Amin suivi d'un petit rire gêné pour qu'on comprenne tout.</p><p dir=""auto"">Enfin, et c'est la facette qui donne toute sa profondeur au film : la grâce. C'est un film touché par une beauté mystique. Le film est rempli d'images clairement religieuses, issues du catholicisme et de l'Islam.</p><p dir=""auto"">Mais au milieu de tout cette beauté, vraie et mystique, tendre et érotique, il y a une douleur. Il y a une blessure, une vraie, et c'est celle d'Amin. Il regarde amoureusement Ophélie qui le néglige, et en rejette toutes les filles qui le convoitent avec tellement d'envie. Il est seul, au milieu de ces plages dorées.</p><p dir=""auto"">Ces trois heures ont tout d'un long mois d'août, où tout est si lent mais pourtant où tout passe si vite. Et à la fin, il ne reste que quelques jolis souvenirs, mais beaucoup de regrets.</p>","","","","","","","","",""
"vivaldi-mon-père-et-moi","Arts - French","Vivaldi, mon Père, et Moi","Avec ses systèmes de son qu'il fabriquait lui-même, mon père emplissait notre maison de musique.","MUSIQUE","Shweta Menon","/entries/articles/vivaldi-my-dad-and-i","2026-03-03T00:00:00.000Z","https://framerusercontent.com/images/dqYpcO7PwY8UdOQqBSZBZgl2CXA.png","","NO","<p dir=""auto"">Lorsque l'on dit que la musique classique peut ressembler à la pluie, on pense souvent à Antonio Vivaldi. Sa musique ne se contente pas d'aligner des notes : elle donne vie à des saisons entières.</p><p dir=""auto"">L'amour de mon père pour le son était immense et profond. Sa passion pour son système hi-fi, ainsi que son désir de construire lui-même ses amplificateurs et ses enceintes grâce à ses compétences d'ingénieur, faisaient de la musique quelque chose de tangible dans notre maison.</p><p dir=""auto"">Toute mon enfance a été bercée à la fois par la musique classique occidentale et par la musique classique indienne. Je me souviens que ma grand-mère insistait pour que j'écoute de la musique classique indienne et m'emmenait à des cours de chant carnatique. J'avais à peine quatre ans.</p><p dir=""auto"">Avec le temps, la musique classique occidentale est devenue quelque chose que mon père et moi partagions tout particulièrement. C'est devenu notre espace silencieux, notre terrain d'entente. À travers des compositeurs comme Mozart, Vivaldi et Bach, nous avons construit un lien qui n'avait pas besoin de beaucoup de mots.</p><p dir=""auto"">Quand on ferme les yeux et que l'on écoute vraiment, on n'est plus dans la pièce. On est ailleurs. Dans Les Quatre Saisons, la pluie douce et les ruisseaux lents semblent délicats et vivants, presque tendres. Puis, soudainement, l'atmosphère change. La pluie devient plus forte. Le tonnerre éclate.</p><p dir=""auto"">Aujourd'hui, je comprends. Ce que mon père m'a transmis n'est pas seulement un amour pour la musique classique. Il m'a donné une manière de me sentir proche de lui, peu importe où nous sommes. Dans ma vie, Vivaldi n'est pas seulement un compositeur. Il fait partie de la façon dont mon père et moi restons connectés.</p>","","","","","","","","",""
"inherent-vice-fr","Arts - French","Inherent Vice","Ce film m'a plongé dans le brouillard hippie de la Californie des années 1970, étrange et familier.","CRITIQUE DE FILM","Augustin Dubois","/entries/articles/inherent-vice-en","2026-02-21T00:00:00.000Z","https://framerusercontent.com/images/KmSmhSBu0zvlVSGTwYi142FK8.png","","NO","<p dir=""auto"">Ce film m'a transporté dans un brouillard hippie californien des années 1970, à la fois inconnues et étrangement intimes. Une longue promenade hébétée et nauséeuse le long des plages, et une ambiance de chaleur et de tranquillité se dégage de l'écran. Entre les couleurs vibrantes et psychédéliques, la partition de fond apaisante qui accompagne les scènes, et les costumes impeccables, je me suis senti plongé dans un petit univers que je ne voulais pas quitter.</p><p dir=""auto"">Le film débute en exposant une intrigue captivante, mais au fur et à mesure que l'histoire avance et que de nouveaux personnages sont constamment dévoilés, on commence à comprendre que le film privilégie peut-être davantage le développement des personnages et des thématiques au détriment d'une narration conventionnelle.</p><p dir=""auto"">Le personnage de Larry « Doc » Sportello, incarné par Joaquin Phoenix, nous est présenté comme un détective instable, défoncé et dévasté, coincé entre hallucinations présumées et réalité. Pourtant, tout au long du film, son comportement et sa personnalité oscillent entre ceux d'un toxicomane et ceux d'un détective élégant et bien habillé.</p><p dir=""auto"">Ce motif se retrouve à de nombreuses reprises dans ce film, peut-être pour montrer, de manière plus globale, la difficulté d'un changement d'époque, d'un changement de mode de vie. La rébellion constante de Doc face à l'autorité, son mode de vie indépendant et son ostracisme vis-à-vis de la société constituent le combat d'une génération, l'attachement désespéré à une époque dorée qui s'efface progressivement sous l'effet de la modernité.</p>","","","","","","","","",""
