"Slug","Section","Title","Description","Category","Author","Traduction","Date","Image","Image:alt","Latest","Text","Poem","Title 1","Poem 1","Title 2","Poem 2","Title 3","Poem 3","Audio File","Audio Quote"
"la-grande-nausée","Fiction - French","La Grande Nausée","Ce que j'ai, c'est un esprit décidu. Tout ce que je peux faire, c'est attendre le printemps.","RECIT COURT","Beatrice Eggleston","/entries/articles/nausea-winter","2026-02-09T00:00:00.000Z","https://framerusercontent.com/images/7eek3MfzMHxkNA9BouMSw0rXIg.png","","NO","<p dir=""auto"">C'est l'hiver et je me sens agitée, consumée par une sensation qui ne peut se décrire que comme une nausée d'une violence écrasante. C'est une sensation physique, mais elle ne vient pas de la maladie, et ne serait soulagée ni par le rejet de mon petit-déjeuner, ni par aucun médicament. Je ne sais pas ce qui pourrait apaiser mon malaise. Une purge brutale, d'une façon ou d'une autre.</p><p dir=""auto"">NAUSÉE/HIVER/NAUSÉE/HIVER/NAUSÉE/HIVER/NAUSÉE/HIVER/</p><p dir=""auto"">J'écris au dos de mon carnet, couvrant la page entière. Je crie dans mon oreiller. Je sors et je cours, je cours jusqu'à ce que mes poumons ordonnent à mon corps de s'arrêter.</p><p dir=""auto"">Le temps passe. À mesure que les matins s'éclaircissent et que les jours s'allongent, mes crises de nausée mystique se font moins fréquentes, moins réelles. Soudain c'est l'été, et je me retrouve entièrement dévouée aux désirs de mon esprit, avec un sentiment de totale liberté et sans rien retenir. Je lis sans culpabilité, j'écris, je dessine, je vis dans le monde réel avec une telle plénitude que ces spirales intérieures hivernales me semblent si insensées que je ne suis plus sûre qu'elles aient jamais existé. Je sens la créativité et la curiosité m'habiter à nouveau, et je recommence à me sentir moi-même.</p><p dir=""auto"">Le temps passe. Le temps passe et, tel un courant, il m'emporte. Je ne me sens pas bouger mais je remarque que mon environnement change. Le ciel s'assombrit, le chant des oiseaux se tait, et je dors jusque tard dans l'après-midi. Je me sens lourde, vide, et mon journal repose intact sur ma table de nuit.</p><p dir=""auto"">Les idées sont fugaces et même dans les moments d'inspiration je n'ai pas l'énergie d'accueillir ma créativité. Durant mes nuits de seize heures je rêve d'être enceinte, et je me réveille déçue de ne pas l'être. Je me replie sur moi-même et cherche l'isolement total. Mon activité mentale est faible, et les crises viscérales de nausée reviennent.</p><p dir=""auto"">Un soir, après un long rituel de bougies, d'encens, de musique et d'une douche aussi chaude que possible, je vois mon journal sur la table de nuit et je commence à écrire.</p><p dir=""auto""><em>« Peut-être que ce désir, cette aspiration intense, primale, corporelle à la naissance que j'éprouve depuis ces derniers mois n'est pas d'ordre physiologique, mais spirituel. »</em></p><p dir=""auto"">Je pense à David Lynch, qui a trouvé un moyen de projeter ses rêves au monde. Je m'immerge dans son sermon : les visions, la méditation transcendantale, des routines d'une rigueur mécaniquement stricte, une capitulation totale de l'énergie aux pratiques créatives.</p><p dir=""auto"">Alors, dans la quête de mobiliser mon esprit, je m'éloigne des distractions : plus de réseaux sociaux, plus de stimulation sans fond. Je travaille mon rythme de sommeil et je me réveille au son d'un réveil analogique, fais les mots croisés et quelques étirements matinaux depuis mon lit, et prends un petit-déjeuner riche en protéines. Je m'immerge dans la littérature, les films, les essais vidéo. J'essaie d'apprendre, j'essaie d'être curieuse. J'essaie d'être passionnée.</p><p dir=""auto"">Et pourtant, quelque chose en moi reste bloqué. Toute initiative que je prends pour m'inviter à créer se heurte à une aversion. La nausée. Je comprends maintenant qu'il n'existe aucune formule pour la création, la productivité, la motivation. Ce que j'ai, c'est un esprit décidu. Tout ce que je peux faire, c'est attendre le printemps.</p>","","","","","","","","",""
"shibuya-dancing-fr","Fiction - French","Shibuya Dancing","Une bande d'amis part à la dérive dans la nuit de Shibuya, des jeux d'alcools aux boîtes de nuit.","RECIT COURT","Skander Lejmi","/entries/articles/shibuya-dancing-en","2026-02-25T00:00:00.000Z","https://framerusercontent.com/images/BnE603Hbf8FfIjOePgKCtntZ7o.png","","NO","<p dir=""auto"">Dom sonna à l'interphone une deuxième fois après trois longues minutes d'attente au pied de l'immeuble. Une irritation sourde montait. Quelques heures auparavant, il avait défendu avec une ferveur disproportionnée sa théorie du dosage parfait de pommes de terre pour une purée respectable, avant de décréter que le silence était la seule issue honorable devant ses amis sans pitié. Mais tout cela appartenait désormais au passé.</p><p dir=""auto"">Samedi dernier, ils traînaient dans un bar près de leur Airbnb quand un Japonais excentrique les avait abordés pour leur parler d'un DJ « à suivre absolument ». Ils n'avaient réellement compris qu'au moment où il s'était mis à tapoter frénétiquement l'affiche collée dans le fumoir. Malgré tout, la certitude presque solennelle qui émanait de l'homme avait suffi à les convaincre.</p><p dir=""auto"">La soirée tant attendue était enfin arrivée.</p><p dir=""auto"">« Ohhh ! » lança dans sa direction un individu encapuchonné, sur un ton fiévreux. Dom, fidèle à ses réflexes, se crispa aussitôt, serrant contre lui un sac qui n'existait pas, avant de se détendre en reconnaissant le visage familier. Ils montèrent l'escalier à toute vitesse pour se retrouver autour de la table du salon.</p><p dir=""auto"">Les cartes, étalées devant eux, formaient une structure arborescente. Dom jeta un coup d'œil rapide à son jeu, prenant soin de ne rien laisser transparaître. Autour de lui, les conversations se succédaient avec une intensité presque diplomatique.</p><p dir=""auto"">À mesure que les cartes se révélaient, les regards se faisaient plus insistants, cherchant déjà des victimes. La sueur perlait. Dom arriva à la dernière carte, celle qui offrait seize gorgées à distribuer sans pitié. Son regard se fixa sur George avec une jubilation presque malveillante.</p><p dir=""auto"">À minuit trente-six, un joueur à la tête d'ornithorynque commença son cérémonial. S'ensuivit une avalanche de piques verbales. Dix minutes plus tard, ils se retrouvèrent dans les rues venteuses de Shibuya.</p><p dir=""auto"">Marchant d'un pas vif devant des restaurants clos, des bars assourdissants et une entreprise d'agrafeuses, ils se frayèrent un chemin à travers les tentacules de Shibuya jusqu'à atteindre la queue du club.</p><p dir=""auto"">À peine entrés, ils furent engloutis par une foule tourbillonnante de lumières, de corps et de musique. Au milieu de la longue pièce, le corps d'un homme chauve luisait sur scène, ses mouvements en parfaite symbiose avec les sons qu'il façonnait. Les joueurs, engloutis dans ce flux, se heurtaient, riaient, sautaient comme six crevettes perdues dans une marée infinie.</p>","","","","","","","","",""
"la-chute-et-l-envol","Fiction - French","La Chute et l'Envol","Dans un bistrot bondé, une blague entendue au vol déclenche le rire volcanique de mon voisin de table.","RECIT COURT","Paul de Fressenel","/entries/articles/anatomy-of-a-laugh","2026-03-06T00:00:00.000Z","https://framerusercontent.com/images/SpuTcLkoPbquRGgeeH6yO5JeUB8.png","","NO","<p dir=""auto"">Le bistrot grouillait. Une odeur d'ail rôti flottait paresseusement dans l'air. J'étais coincé, mes coudes pris au piège entre deux inconnus. Je protégeais mon verre comme un fragile trésor. En face de moi, un homme rencontré quelques minutes plus tôt arborait un sourire de politicien.</p><p dir=""auto"">Après l'échange de politesses d'usage, le silence s'était installé confortablement entre nous. Son regard était fixé ailleurs. Après une enquête minutieuse, je compris qu'il prêtait une oreille appliquée à la table d'à côté. Naturellement, je me mis à écouter aux portes. Au bout d'un moment, le conteur improvisé prit de l'élan. Soudain, avec un retournement abrupt, il livra la chute :</p><p dir=""auto"">- <em>« Et c'est comme ça que je me suis retrouvé élu maire par accident ! »</em></p><p dir=""auto"">Amusé par cette fin inattendue, je laissai échapper un petit rire par le nez et me retournai vers ma table. Mon compagnon de dîner me regardait. Sa tête était légèrement penchée et un demi-sourire s'était installé sur le coin de sa bouche.</p><p dir=""auto"">D'un coup, sans prévenir, il éclata. Un rire brutal, total, indiscipliné. Le bistrot se figea. Ce rire ne venait pas de sa gorge, mais de plus bas, de plus loin. Du ventre, du diaphragme, des os même. Son visage se fendait sous la pression, son corps se repliait sur lui-même, les bras serrés contre les côtes.</p><p dir=""auto"">J'observais, fasciné, cet adulte en pleine cinquantaine se livrer tout entier à l'hilarité. Son corps venait de déclarer son indépendance, brandissant un drapeau invisible où l'on pouvait lire : <em>je ne réponds devant personne !</em> Je venais d'assister à un petit miracle : la conspiration parfaite d'une dizaine de muscles, de nerfs, et de réflexes qui étaient parvenus à destituer le cortex préfrontal, siège de la raison.</p><p dir=""auto"">Cette scène me rappela mes expériences passées dans la comédie. Le petit théâtre qu'est raconter une blague. J'ai toujours observé les spécialistes que je connais avec une sorte de fascination anthropologique. Leur boîte à outils est infinie. L'exagération. La parodie. L'ironie, ce sourire rusé de l'intellect. L'absurde. Chacun une variation du même motif : la dissonance.</p>","","","","","","","","",""
"eloge-de-la-mauvaise-foi","Fiction - French","Eloge de la Mauvaise Foi","Une amatrice de gossips et un guru du « good vibes only » se retrouvent autour d'un verre.","RECIT COURT","Madeleine Bellucci","/entries/articles/killed-by-kindness","2026-03-02T00:00:00.000Z","https://framerusercontent.com/images/D4OVRh41g9eFZS41sde8HrYcKk.png","","NO","<p dir=""auto"">J'arrive au bar et je suis en avance, ce qui me laisse le temps idéal pour juger silencieusement tout le monde autour de moi. À ma droite : un couple où l'homme n'arrête pas de me regarder. À ma gauche : une bande de jeunes de dix-neuf ans qui tissent des liens virils autour de litres de bière et d'une intelligence émotionnelle fraîchement découverte.</p><p dir=""auto"">Je suis venue préparée, évidemment. J'ai La Liste — vous savez, celle qu'on compile tous avant de voir une nouvelle connaissance. La mienne comprend : trois anecdotes humiliantes de cette semaine, des ragots de qualité sur des gens que Raphaël ne connaît même pas encore, et bien sûr, les anecdotes classiques sur les individus sulfureux qui me suivent à la sortie du métro.</p><p dir=""auto"">Raphaël finit par arriver et on se fait la bise — qui, soyons honnêtes, est la tentative de toute une vie des Français pour sexualiser des situations qui n'ont absolument pas besoin d'impliquer des joues, des lèvres ou une chorégraphie de têtes gênante.</p><p dir=""auto"">Je m'apprête à plonger dans ma première humiliation de la semaine quand Raphaël tape des mains sur la table et lance : « Tu veux peut-être aller nous chercher deux bières ? » avec ce sourire aux yeux écarquillés de <em>golden retriever</em> qui dit : je suis inoffensif et adorable et potentiellement un peu parasite.</p><p dir=""auto"">Donc je trotte jusqu'à l'autel du bar, où une barmaid à la coupe au bol avec des tatouages botaniques sur les avant-bras s'applique à refuser de reconnaître mon existence.</p><p dir=""auto"">Pendant que j'attends, je repasse le moment dans ma tête. La façon dont il l'a dit. Nous <em>chercher</em> deux bières. Avec quelle facilité il m'a fait me lever et payer nos verres. C'était fluide. Presque... élégant. Comme une arnaque, mais sympa.</p><p dir=""auto"">On descend tous les deux nos bières et je viens de finir de débiter mes trois histoires humiliantes de la semaine. Il ne rit pas autant que je l'espérais. En fait, ses réactions faciales oscillent quelque part entre légèrement amusé et chaise de café au repos.</p><p dir=""auto"">Je continue, m'enfonce davantage dans la trahison féminine : « elle est littéralement la personne la plus égoïste que je connaisse. Cas d'école. »</p><p dir=""auto"">Je suis toujours en train de débiner ma meilleure amie quand je remarque que le visage de Raphaël n'a pas bougé une seule fois. Il a la même expression que vous auriez en regardant quelqu'un assembler un meuble IKEA.</p><p dir=""auto"">« Lena... » il dit. Je m'arrête. « C'est juste... j'essaie vraiment d'être plus positif ces derniers temps. Et... je sais pas, tu dis plein de trucs négatifs. Depuis une heure. Et c'est juste que... ça me laisse un goût amer dans la bouche. »</p><p dir=""auto"">Silence. Mon cœur s'effondre. J'ai l'impression de m'être pris une claque. Violente. Et avec un poisson mort.</p><p dir=""auto"">Mais je souris — le genre de sourire cassant qu'on fait quand quelqu'un vous dit qu'il est vraiment à fond dans la crypto.</p><p dir=""auto"">Dans le métro du retour, j'ouvre mon appli Notes et je tape : « Histoire sur le connard de la positivité à raconter au prochain verre. » Et puis je souris toute seule. Sourire c'est positif, non ? ;)</p>","","","","","","","","",""
"the-world-of-yesterday","Literature - English","The World of Yesterday","Has there ever been a more thoroughly European writer than Stefan Zweig?","BOOK REVIEW","Peter Meilaender","","2026-05-06T00:00:00.000Z","https://framerusercontent.com/images/beaLuBNhGQR1GUnkJb097NZCaI.png","","English","<p dir=""ltr"">Romain Rolland. Thomas Mann. H. G. Wells. Hugo von Hofmannsthal. James Joyce. Jane Addams. Arthur Schnitzler. Richard Strauss. Maurice Ravel. Béla Bartók. Arturo Toscanini.</p><p dir=""ltr"">Question: What do they all have in common?</p><p dir=""ltr"">Answer: They are some of the famous names that appeared in the guestbook at Stefan Zweig's home in Salzburg between the World Wars, a home that fulfilled a dream of his by becoming <em>a European house</em>.</p><p dir=""ltr"">We find them all, together with other famous acquaintances — Herzl, Rilke, Freud, von Suttner — between the covers of Zweig's extraordinary memoir, <em>The World of Yesterday</em>. It is as if Zweig had captured the spirit of the Viennese coffeehouse, simultaneously intellectual and convivial, and spread it across the entire European continent in a restless search for a border-crossing fraternity of the mind.</p><p dir=""ltr"">Has there ever been a more thoroughly European writer than Stefan Zweig? From Austria to Germany, Brussels, France, England, Switzerland, Italy, even the Soviet Union — <em>The World of Yesterday</em> relates Zweig's travels back and forth across the continent, his countless friendships, his literary efforts and his translations, his endless affirmation and encouragement of other artists.</p><p dir=""ltr"">As Zweig describes his remarkable network of acquaintances, a veil of elegiac melancholy hangs over his words. For we know where it is all heading. <em>The World of Yesterday</em> is ultimately tragic, because the <em>world of security</em> in which Zweig grew up, during the late decades of the Habsburg Empire, is careening toward its destruction in two terrible wars. The tragedy is not simply cultural or political, it is also deeply personal: Zweig finished the memoir less than a year before he committed suicide together with his second wife, Lotte, in Petrópolis, Brazil, his dream of European fellowship crushed by war and exile.</p><p dir=""ltr"">Somehow, Zweig maintained his commitment to personal freedom, a freedom of the spirit, up until the end. <em>'For me,'</em> he writes, <em>'personal liberty was the most important thing on earth.'</em></p><p dir=""ltr"">The memoir's sad ending, however, by no means negates the cheerful, even optimistic spirit that radiates from the pages of Zweig's book. It is impossible to read <em>The World of Yesterday</em> and not be inspired by his boundless enthusiasm for artistic creativity and an international republic of letters.</p><p dir=""ltr"">Tucked between pages 140 and 141 of my own copy of <em>The World of Yesterday</em> is a faded but still legible receipt: « <em>14 March 2016, Café Landtmann, Universitätsring 4, Vienna.</em> » One of the great Viennese coffeehouses, it existed already in Zweig's day. There would be worse ways to honor Zweig's memory than by gathering in a Viennese coffeehouse with friends from around the continent to reinvigorate the spirit of intellectual brotherhood that he so loved.</p>","","","","","","","","",""
"salammbo-flaubert-en","Literature - English","Salammbô, Flaubert","As formidable as the elephants that traverse its pages, destroying everything in their path.","BOOK REVIEW","Anna Kowalska","/entries/articles/salammbo-flaubert-fr","2026-03-09T00:00:00.000Z","https://framerusercontent.com/images/U73axqrxLZXy5J7mXewyt08pNc.png","","NO","<p dir=""auto"">I began the year with Flaubert's <em>Salammbô</em>, inspired by his adventures in the Near East. I don't think we have visited the same holiday resorts. Form-fitting tunics, oiled and muscle-bound Maciste figures in sandals, princesses baring their navels — none of this appeals to me. And yet, for all that, I consider it a literary masterpiece.</p><p dir=""auto"">From the opening lines, the tone is established. It is at once disarmingly simple, remarkably poetic, and lavishly exotic. Listen closely, for Flaubert offers the singular pleasure of reading aloud: <em>'It was at Megara, a suburb of Carthage, in the gardens of Hamilcar.'</em> It sounds like the beginning of a fable, with this resonant and harmonious sentence that rings like a haiku and compels you to turn the page.</p><p dir=""auto"">It is an immense novel, like the elephants that traverse its pages, crushing everything in their path. Flaubert's imagination here reaches its zenith. A tempest of images. An avalanche of sensations, emotions, consuming passion.</p><p dir=""auto"">We are in the third century BC, following the First Punic War. The wealthy merchants of Carthage, more preoccupied with their fortunes than with the city itself, refuse to pay what they owe the mercenary army that fought valiantly against Rome alongside Hamilcar. The mercenaries thus resolve to revolt and besiege the city. One man, the mercenary leader, the Libyan Mâtho, falls desperately in love with Salammbô, the general's daughter and priestess of Tanit, goddess of the Moon. From this encounter springs a fatal bond that will plunge all into war.</p><p dir=""auto"">It is a narrative of tremendous savagery. Flaubert's language, in its precision, exists to articulate the unspeakable. Salammbô embodies not merely passionate love — she is a femme fatale, accursed, like those figures from mythology whose beauty sparked wars and precipitated the collapse of empires. How can one not think of Helen, of the Trojan War, of the <em>Iliad</em>? The luminous beauty of Salammbô's prose is timeless. It is as intoxicating and devastating as the armies that clash beneath the Carthaginian sun.</p>","","","","","","","","",""
"the-death-of-ivan-ilyitch","Literature - English","The Death of Ivan Ilyitch","And it is in this dissolution, in the humiliating proximity of death, that something extraordinary happens.","BOOK REVIEW","Milana Petrova","/entries/articles/la-mort-d-ivan-ilyitch","2026-03-02T00:00:00.000Z","https://framerusercontent.com/images/aPLo3JY2EosJqjmByAwHDd38.png","","NO","<p dir=""auto""><em>The Death of Ivan Ilyich</em> is a short book about a man who wastes his life and dies. This summary is accurate and completely beside the point. What Tolstoy actually wrote is a precise, merciless account of what happens when a person never once asks themselves whether the life they are living is genuinely their own.</p><p dir=""auto"">Ivan Ilyich, Tolstoy's celebrated magistrate, has spent his lifetime suppressing his affinities. He constructs his existence with the careful, joyless efficiency of a bureaucrat filing papers: the correct career, the correct wife, the correct furnishings in the correct drawing room. He belongs to the class of people for whom the performance of a life has entirely displaced the living of one. When he hangs the drapes in his new apartment, Tolstoy tells us he feels a particular pleasure, not the pleasure of beauty, but of conformity, of having arranged things <em>'as people of a certain standing arrange them.'</em></p><p dir=""auto"">Then the fall. Literally: a banal domestic accident while hanging curtains leaves him with an internal injury that will not heal. The body, which social convention cannot discipline as thoroughly as the mind, begins its slow refusal. And it is in this dissolution, in the humiliating proximity of death, that something extraordinary happens. The masks begin to slip. Ivan Ilyich fights it, retreating into denial, into the bureaucratic fantasy that the right doctor, the right diagnosis, the correct procedure will file the illness away and restore order. But the body does not comply.</p><p dir=""auto"">In his final hours, after an agonized confession to his son that he has lived badly, something releases. In slowly allowing the raw and authentic parts of himself to finally surface — the regret, the vulnerability — Ivan Ilyich steps, for the first time, into alignment.</p><p dir=""auto"">What Tolstoy tells us is that the necessary condition for these affinities to crystallize into moments of alignment is that of authenticity. In accepting rather than concealing our inner nature, our identity unfolds as a collection of resonances that we have allowed to materialize. In the spontaneous laugh that escapes us, the involuntary rush in our eyes when we recognise love, our authentic pulse opens up a space, allowing us, for a brief moment, to be aligned.</p>","","","","","","","","",""
"on-creative-alienation","Literature - English","On Creative Alienation","While imagination holds no limit, the painting must fit on the canvas and the symphony must unfold on time.","SHORT ESSAY","Paul de Fressenel","/entries/articles/sur-l-aliénation-de-l-artiste","2026-02-26T00:00:00.000Z","https://framerusercontent.com/images/rvX2lCV3QUZ0aNPvs4TphUOeb8E.png","","NO","<p dir=""auto"">In <em>The Glass Bead Game</em>, Hermann Hesse presents a character, the Music Master, who has dedicated his life to discovering the correspondence between mathematical order and musical beauty. As he exposes the state of his research, he shares his terrible torment: in his introspection, he has glimpsed, in moments of profound clarity, <em>'the pure essence of mathematical harmony in music'</em>. Yet, the instant his pen approaches the parchment, each note he attempts to transcribe seems to betray the perfect harmonies he has touched upon inwardly.</p><p dir=""auto"">Here lies what Hesse characterizes as 'the eternal struggle of the creative process'. When the artist attempts to give form to his inner vision in order to fix it in place, he finds that it is inevitably alienated, compressed into the finite constraints of form and language. While imagination holds no boundaries, the painting must fit on the canvas, the symphony must unfold on time, the novel must proceed through sequential pages.</p><p dir=""auto"">Yet perhaps the perpetual failure of the artist to attain authentic representation points not to art's limitation but to its true purpose. In <em>The Origin of the Work of Art</em>, Martin Heidegger suggests that the function of art is not one of representation but of disclosure: the artwork should not represent the inner experience of the artist, but instead create conditions where such experience can unfold within the viewer. While the precise architecture of Mozart's compositions may be only an approximation of the transcendent state he felt while writing them, they create an environment that allows for direct encounter with the Sublime. The failure of perfect representation becomes the source for infinite other visions to unfold.</p>","","","","","","","","",""
