"Slug","Section","Title","Description","Category","Author","Traduction","Date","Image","Image:alt","Latest","Text","Poem","Title 1","Poem 1","Title 2","Poem 2","Title 3","Poem 3","Audio File","Audio Quote"
"narcissus-and-goldmund-en","Literature - English","Narcissus and Goldmund","In this initiation novel, Hermann Hesse carves out the duality between the thinker and the artist.","BOOK REVIEW","Laura Schäfer","/entries/articles/narcissus-and-goldmund-fr","2026-02-19T00:00:00.000Z","https://framerusercontent.com/images/ka3b4zWvAEfCXPRPdVekBuEXwR8.png","","NO","<p dir=""auto"">Behind the cloistered walls of the Mariabronn monastery, Narcissus, a young monk, pursues a life of extreme discipline and abstinence. Into this sanctuary arrives ardent Goldmund, a student imbued by his father with an ambition to pursue this same sacred path. These two characters portray the inherent duality that we find in ourselves.</p><p dir=""auto"">In establishing the contrast between the thinker and the artist, Hesse carves out two symbols of human identity. Narcissus is the paragon of the paternal path, distilling meaning through rigorous intellectual contemplation. Goldmund lies on the other side, the epitomical symbol of the maternal path, where meaning is derived through immersion in life's immediate intensity.</p><p dir=""auto"">Narcissus says to Goldmund: <em>'Natures of your kind, with strong, delicate senses, the soul-oriented, the dreamers, poets, lovers are almost always superior to us creatures of the mind. You take your being from your mothers. You live fully; you were endowed with the strength of love, the ability to feel. Whereas we creatures of reason, we don't live fully; we live in an arid land, even though we often seem to guide and rule you. Yours is the plenitude of life, the sap of the fruit, the garden of passion, the beautiful landscape of art. Your home is the earth; ours is the world of ideas. You are an artist; I am a thinker. You sleep at the mother's breast; I wake in the desert.'</em></p><p dir=""auto"">Once awakened to his authentic nature, Goldmund plunges into the chaotic undercurrents of reality, wandering highways and forests, enduring physical hardship, and embracing both the ecstasies and agonies that come from looking life in the eye.</p><p dir=""auto"">Having disarmed the reader, almost as Narcissus disarms Goldmund, Hesse can finally invite his profound, long-awaited questioning of how we ought to live, a questioning that now puts freedom and discipline on equal footing.</p>","","","","","","","","",""
"kolkhoze","Literature - French","Kolkhoze","Une lecture à la lumière de Marguerite Yourcenar, entre lucidité filiale et dignité face à la mort.","CRITIQUE","Anna Canonne","","2026-05-20T00:00:00.000Z","https://framerusercontent.com/images/1W8iTuSHY8HWRdHwXktUiSiLmE.png","","NO","<p dir=""ltr"">Dans <em>Souvenirs Pieux</em>, le premier tome de la trilogie qu'elle consacre à sa famille, Marguerite Yourcenar, dont la mère est morte en lui donnant naissance, se demande si, l'ayant connue, elle l'aurait aimée. Pour ceux qui ne se bercent pas d'illusions et regardent en face ce qui est — nul doute qu'Emmanuel Carrère appartient à cette catégorie — ces propos frappent par leur honnêteté foncière et leur grande justesse.</p><p dir=""ltr"">Il existe néanmoins une différence de taille entre Emmanuel Carrère et Marguerite Yourcenar : lui a connu l'amour sans limite qui l'a uni à sa mère dans l'enfance, une mère dont il a re-découvert grâce à l'écriture de ce livre combien elle était tendre, aimante, protectrice sans être étouffante. Une mère merveilleuse qui, lors des absences répétées du père, aimait rassembler pour la nuit ses trois enfants autour d'elle dans la chambre conjugale pour y « faire kolkhoze ».</p><p dir=""ltr"">Si sa mère, Hélène Carrère d'Encausse née Zourabichvili, apatride comme l'étaient ses parents et ses grand-parents chassés de Géorgie et de Russie par la révolution de 1917, est l'héroïne de Kolkhoze, une autre figure évolue dans son ombre. C'est cela aussi, l'inespéré pour Emmanuel Carrère : accorder davantage de place dans le récit et en lui-même à son père Louis qui, depuis sa rencontre avec la flamboyante Hélène jusqu'à sa mort, a résolument choisi le côté de sa femme.</p><p dir=""ltr"">Ce désaccord profond entre ce que l'on doit taire et ce que l'on doit révéler, entre mensonge et vérité, fracture la famille en deux, avec de part et d'autre deux visions irréconciliables.</p><p dir=""ltr"">L'histoire retiendra peut-être, au-delà de son parcours exceptionnel, qu'Hélène Carrère d'Encausse est entrée dans la mort avec une majestueuse humilité, conférant à ses derniers instants une grandeur qui m'est apparue comme le couronnement d'une vie.</p>","","","","","","","","",""
"cyrano-de-bergerac","Literature - French","Cyrano de Bergerac","Ah ! Cyrano ! Cyrano ! Je défaille à ton nom, à ta seule évocation, noble Sire, anneau de mes épousailles avec la lyre.","CRITIQUE","Chris Chauvin","","2026-05-06T00:00:00.000Z","https://framerusercontent.com/images/vCKEmqw3QLElDM1YCEsmreXv7A.png","","French","<p dir=""auto"">Ah ! Cyrano ! Cyrano ! Je défaille à ton nom, à ta seule évocation, noble Sire, anneau de mes épousailles avec la lyre, avec la fougue, avec l'immatériel.</p><p dir=""auto"">Il y a quelque chose d'une époque révolue, quelque chose comme on n'en fait plus. Même pour l'époque de Rostand, un je-ne sais-quoi, un parfum 1600, un mélange de Cervantès et de Shakespeare.</p><p dir=""auto""><em>Cyrano de Bergerac</em> est l'ultime avatar de ces temps où le français était un art, ou dentelle ou brodé, piqué, surpiqué un fil d'or de douze pieds ; un art qu'on plaçait comme un étendard pour dire : « Vous voyez, je suis Français, jugez comme ça sonne ! »</p><p dir=""auto"">Indéniablement, il y a du Don Quichotte dans Cyrano, une chevalerie d'un autre temps, batailleur pour un rien et surtout si c'est inutile. Le personnage de Don Quichotte est d'ailleurs mentionné dans la pièce. Il y a également dans son amour illimité pour Roxane une bonne dose de celui de l'hidalgo pour sa Dulcinée.</p><p dir=""auto"">Il y a aussi indubitablement des accents shakespeariens tels que la fameuse scène du balcon de l'acte III, qui évoque sans ambages <em>Roméo et Juliette</em>.</p><p dir=""auto"">Rostand intitule sa pièce « comédie héroïque » ; j'écrirais plus volontiers tragi-comédie car constamment, derrière des bribes de comique, il y a de la douleur, du tragique, des souffrances pudiquement retenues qui évoquent en nous des larmes qui n'ont rien d'un rire.</p><p dir=""auto"">Cette pièce est une histoire d'amour, enrobée dans beaucoup d'autres choses. L'amour d'un homme qui porte une plaie béante en plein milieu de la figure, qui lui interdit d'accéder à la félicité d'être aimé par celle qu'il voudrait.</p><p dir=""auto"">Ce Cyrano, si laid dehors, si beau dedans, touche à l'inconscient collectif. Peut-être est-ce là le vrai secret de Cyrano : matérialiser cette incompréhension du monde à notre charme et à notre beauté intérieure.</p>","","","","","","","","",""
"les-nuits-blanches","Literature - French","Les Nuits Blanches","On y sent en germe les fragiles penchants du prince Muichkine de L'Idiot ou du Aliocha des Frères Karamazov.","CRITIQUE","Chris Chauvin","","2026-04-27T00:00:00.000Z","https://framerusercontent.com/images/BdWyZB3zXkX3fkv2rOR5pLH7sH0.png","","French","<p dir=""auto"">Les Nuits Blanches, c'est l'histoire d'un éclair, puis la nuit. C'est l'histoire d'une rencontre improbable entre deux êtres improbables.</p><p dir=""auto"">Dostoïevski est vraiment tout à fait lui-même dans cette nouvelle ; torturé, hypersensible, amoureux, naïf, pessimiste et inadapté socialement. Ses personnages sont tout cela, et l'on y sent en germe les fragiles penchants du prince Muichkine de L'Idiot ou du Aliocha des Frères Karamazov.</p><p dir=""auto"">Un homme, un original, un rêveur, un marginal passe son temps à se construire des contes à propos de tout ; des lieux, des personnes qu'il croise, de la psychologie intime ou du revêtement extérieur de chaque maison qu'il côtoie.</p><p dir=""auto"">Le soir, c'est son moment favori, car il y peut à loisir laisser divaguer son esprit fécond dans de folles digressions quand la nuit drape d'un voile de ténèbres ces si belles rues de Pétersbourg.</p><p dir=""auto"">Un soir précisément, alors qu'il est occupé à détailler les faciès des hommes et les façades des maisons, notre homme croise une femme accoudée au parapet d'un pont sur la Neva. Elle semble pleurer.</p><p dir=""auto"">Gauche, timide, peu sûr de lui et conscient de sa relative inadaptation au monde des humains, le narrateur hésite à l'aborder. Soudain, un homme sur l'autre trottoir, un homme éméché qui semble vouloir chercher noise à la petite créature du pont. Le narrateur court lui porter secours. L'importun est écarté, la conversation peut commencer.</p><p dir=""auto"">Fiodor Dostoïevski met toute sa sensitivité, sa sensibilité, son acuité émotionnelle dans la narration de cette nouvelle, une pure et délectable histoire d'amour.</p>","","","","","","","","",""
"salammbo-flaubert-fr","Literature - French","Salammbô, Flaubert","Aussi formidable que les éléphants qui traversent les pages, détruisant tout sur leur passage.","CRITIQUE","Anna Kowalska","/entries/articles/salammbo-flaubert-en","2026-03-09T00:00:00.000Z","https://framerusercontent.com/images/U73axqrxLZXy5J7mXewyt08pNc.png","","NO","<p dir=""auto"">J'ai attaqué l'année avec <em>Salammbô</em> de Gustave Flaubert, inspiré par ses escapades au Proche-Orient. Je n'ai pas dû fréquenter les mêmes clubs de vacances. Les tuniques moulantes, les Maciste en sandales huilés ne constituent pas ma tasse de thé. Et pourtant c'est, pour moi, un véritable chef-d'œuvre littéraire.</p><p dir=""auto"">Dès l'incipit, le ton est donné. Il est à la fois d'une simplicité désarmante, d'une poésie inouïe et d'un exotisme flamboyant. Écoutez un peu, car Flaubert, c'est aussi le bonheur de le lire à haute voix : <em>'C'était à Mégara, faubourg de Carthage, dans les jardins d'Hamilcar.'</em> Cela ressemble au début d'une fable. C'est un roman énorme comme les éléphants qui traversent les pages, détruisent tout sur leur passage.</p><p dir=""auto"">Nous sommes au IIIe siècle avant J.C., après la première guerre punique. Les riches marchands de Carthage refusent de payer ce qu'ils doivent à l'armée de mercenaires. Ils décident alors de se révolter et d'attaquer la ville. Un homme, le chef des mercenaires, le libyen Mâtho tombe alors éperdument amoureux de Salammbô, la fille du général mais aussi prêtresse de Tanit déesse de la Lune.</p><p dir=""auto"">C'est un récit d'une très grande férocité. Les mots de Flaubert dans leur justesse sont là aussi pour dire l'innommable. Dans ce désastre et cette folie, Salammbô n'incarne pas que la passion amoureuse, c'est une femme fatale, damnée, comme celles des récits de la mythologie. La beauté fluide de l'écriture de Salammbô est intemporelle. Elle est envoûtante et dévastatrice comme les armées qui s'affrontent sous le soleil de Carthage.</p>","","","","","","","","",""
"la-mort-d-ivan-ilyitch","Literature - French","La Mort d'Ivan Ilyitch","Et c'est dans cette dissolution, dans l'humiliante proximité de la mort, que survient l'extraordinaire.","CRITIQUE","Milana Petrova","/entries/articles/the-death-of-ivan-ilyitch","2026-03-02T00:00:00.000Z","https://framerusercontent.com/images/aPLo3JY2EosJqjmByAwHDd38.png","","NO","<p dir=""auto""><em>La Mort d'Ivan Ilitch</em> est une nouvelle sur un homme qui gâche sa vie et meurt. Ce résumé est exact mais passe complètement à côté de l'essentiel. Ce que Tolstoï a réellement écrit est un récit précis et sans pitié de ce qui arrive quand on ne se demande jamais si la vie que l'on mène est véritablement la sienne.</p><p dir=""auto"">Ivan Ilitch, le célèbre magistrat de Tolstoï, a passé sa vie à étouffer ses affinités. Il bâtit son existence avec l'efficacité mécanique et sans joie d'un bureaucrate classant ses dossiers : la carrière qu'il faut, l'épouse qu'il faut, les meubles qu'il faut dans le salon qu'il faut. Lorsqu'il accroche les rideaux de son nouvel appartement, Tolstoï nous dit qu'il y trouve un plaisir particulier, non pas celui du beau, mais celui de la conformité.</p><p dir=""auto"">Puis la chute. Au sens propre : un banal accident domestique lui laisse une blessure qui ne guérira pas. Le corps, que la convention sociale ne saurait discipliner aussi complètement que l'esprit, amorce son lent refus. Et c'est dans cette dissolution, dans l'humiliante proximité de la mort, que survient l'extraordinaire. Les masques commencent à glisser.</p><p dir=""auto"">Dans ses dernières heures, après une confession déchirante à son fils où il reconnaît avoir mal vécu, quelque chose se desserre. En laissant enfin affleurer les parts les plus brutes et les plus vraies de lui-même, Ivan Ilitch rencontre, pour la première fois, <em>l'alignement</em>.</p>","","","","","","","","",""
"sur-l-aliénation-de-l-artiste","Literature - French","Sur l'Aliénation de l'Artiste","Alors que l'imagination est sans limite, le tableau doit tenir sur la toile et la symphonie dans les temps.","ESSAI COURT","Paul de Fressenel","/entries/articles/on-creative-alienation","2026-02-26T00:00:00.000Z","https://framerusercontent.com/images/rvX2lCV3QUZ0aNPvs4TphUOeb8E.png","","NO","<p dir=""auto"">Dans <em>Le Jeu des perles de verre</em>, Hermann Hesse met en scène un personnage, le Maître de la Musique, qui a consacré sa vie à découvrir la correspondance entre l'ordre mathématique et la beauté musicale. En exposant ses recherches, il partage son terrible tourment : dans son introspection, il a entrevu, dans des moments de profonde clarté, <em>'l'essence pure de l'harmonie mathématique dans la musique'</em>. Pourtant, dès l'instant où sa plume s'approche du parchemin, chaque note qu'il tente de retranscrire lui semble trahir les harmonies parfaites qu'il a effleurées intérieurement.</p><p dir=""auto"">C'est là que réside ce que Hesse caractérise comme 'la lutte éternelle du processus créatif'. Lorsque l'artiste tente de donner forme à sa vision intérieure, il découvre qu'elle se trouve inévitablement aliénée, comprimée dans les contraintes finies de la forme et du langage. Tandis que l'imagination ne connaît aucune limite, le tableau doit tenir sur la toile, la symphonie doit se déployer dans le temps, le roman doit s'enchaîner à travers des pages séquentielles.</p><p dir=""auto"">Pourtant, l'échec perpétuel de l'artiste à atteindre une représentation authentique ne renvoie peut-être pas à la limitation de l'Art mais à sa véritable raison d'être. Dans <em>L'Origine de l'Œuvre d'art</em>, Martin Heidegger suggère que la fonction de l'art n'est pas celle de la représentation mais celle du dévoilement. Bien que l'architecture précise des compositions de Mozart ne soit peut-être qu'une approximation de l'état transcendant qu'il ressentait en les écrivant, elles créent un environnement qui permet la rencontre directe avec le Sublime.</p>","","","","","","","","",""
"narcissus-and-goldmund-fr","Literature - French","Narcisse et Goldmund","Dans ce roman initiatique, Hermann Hesse met en lumière la dualité entre le penseur et l'artiste.","CRITIQUE","Laura Schäfer","/entries/articles/narcissus-and-goldmund-en","2026-02-19T00:00:00.000Z","https://framerusercontent.com/images/ka3b4zWvAEfCXPRPdVekBuEXwR8.png","","NO","<p dir=""auto"">Derrière les murs clos du monastère de Mariabronn, Narcisse, jeune moine d'une discipline exemplaire, mène une existence d'ascèse et de rigueur. C'est dans ce sanctuaire qu'arrive Goldmund, un jeune étudiant que son père destine à la même vocation. Ces deux êtres incarnent une dualité que chacun de nous porte en soi.</p><p dir=""auto"">En les confrontant, Hesse façonne deux figures de l'identité humaine. Narcisse représente la voie paternelle : il cherche le sens dans la contemplation rigoureuse et l'abstraction. Goldmund, lui, se tient à l'opposé. C'est le symbole de la voie maternelle, où le sens jaillit de l'immersion dans l'immédiateté de la vie.</p><p dir=""auto"">Narcisse dit à Goldmund : <em>« Les natures comme la tienne, dotées de sens vifs et délicats, les êtres tournés vers l'âme, les rêveurs, les poètes, les amants, vous êtes presque toujours supérieurs à nous, créatures de l'esprit. Vous tenez votre être de vos mères. Vous vivez pleinement. »</em></p><p dir=""auto"">Une fois éveillé à sa vraie nature, Goldmund se jette dans les courants désordonnés du monde réel, errant sur les routes et dans les forêts, traversant épreuves et souffrances, embrassant les extases et les tourments que réserve le face-à-face avec la vie.</p><p dir=""auto"">Ayant ainsi désamorcé les défenses du lecteur, Hesse peut enfin poser sa grande question, longuement préparée : comment devons-nous vivre ? Une question qui, désormais, place la liberté et la discipline sur un pied d'égalité.</p>","","","","","","","","",""
"etude-blue","Arts - English","Etude Blue!","A celebration of music through Etude Blue and a eulogy to the catastrophic inadequacy of language.","MUSIC","Léopold Sinclair","","2026-04-30T00:00:00.000Z","https://framerusercontent.com/images/GR0NCzltbqnzYrqQmUYgwYiJEOE.png","","English","<p dir=""ltr"">Try describing the smell of your childhood dish. Language is catastrophically ill-equipped for this task. Although it has done extraordinary things within its jurisdiction, and its jurisdiction is vast, it was not built for this. It was built for coordination: for telling someone where the water is, for negotiating the terms of a trade, for establishing which berries are poison.</p><p dir=""ltr"">Even in its most elevated form or in the hands of its most gifted practitioners, we can still feel the gravitational pull of the practical: words want to mean things. Specific, verifiable, communicable things. They want to point at objects in the world and say: <em>that</em>. And they are most comfortable when there is a <em>that</em> to point at.</p><p dir=""ltr"">Music has no <em>that</em>. It points sideways, or in some direction for which there is no such preposition.</p><p dir=""ltr"">Listening to <em>Etude Blue</em> for the first time, I saw myself lying on a field of grass with a lover in Central Park, even though I was in France, alone, and I have never set foot in New York. For some reason, this sequence of vibrations colonized my chest and tricked my brain into welcoming this entirely invented scene. Isn't this free online teleporter the strongest rebellion against the finitude and chaos of insatiable time?</p><p dir=""ltr"">Over the years, I have learned to take advantage of it. All of a sudden, I was six years old, standing in my grandmother's kitchen, watching her cut cookies into squares. Not rounds! She said <em>'Non è originale!'</em>. I could smell the air, the oven, I could see her beautiful crooked smile.</p><p dir=""ltr"">I have absolutely no certainty that your response will resemble mine even remotely. Some of you may find this ridiculous, others beautiful. This is either a miracle or a trick, and the exhilarating thing is that the distinction does not matter.</p>","","","","","","","","https://framerusercontent.com/assets/A3K6g6Ffjxdj34CtB1othtsvY.mp3","Etude Blue by BAIRD. Listen while reading."
"nietzsche-through-marty-mauser-and-alysa-liu","Arts - English","Nietzsche through Marty Mauser and Alysa Liu","These two characters reignite the force that drives you to paint on a larger canvas.","MOSAIC","Adrien Bréval","/entries/articles/sur-nietzsche-chez-marty-mauser-et-alysa-liu","2026-04-27T00:00:00.000Z","https://framerusercontent.com/images/qzJh8CLfgNMrxFIASbLEpx0E9o.png","","English","<p dir=""ltr"">Ordinary life tends to follow the same worn script: a comfortable monotony governed by constraints and punctuated by sorrow. But every so often, lightning strikes. A burning shock that grabs you by the collar and whispers that there is more to this existence than its slow, languid suffocation.</p><p dir=""ltr"">In <em>The Gay Science</em>, Nietzsche writes that happiness lives inside the struggle. Reading him, it's hard not to feel summoned toward something greater. A spark catches somewhere deep in the gut: the call to excellence. <em>'Ultimate nobility lies in the exception.'</em> A mantra that has driven whole generations to throw themselves entirely into becoming an athlete, a philosopher, an astrophysicist, a pianist. But sometimes routine wins. Sometimes the light that once guided you dissolves into the fog of doubt and exhaustion.</p><p dir=""ltr"">On a Friday evening, I went to see <em>Marty Supreme</em>. The most Nietzschean film I have ever watched. Marty Mauser himself: arrogant, amoral, consumed by a dream as pure as a diamond. I have never seen outsized ambition, wild and irrational optimism, embodied so fully on screen. Every frame sweats with panache, with a loose-limbed confidence, with the absolute urgency of becoming who you are, whatever it costs. Josh Safdie's film is an invitation to devour life in all its contradictions, much like Nietzsche's <em>amor fati</em>.</p><p dir=""ltr"">A few days later, I turned on the television for the Olympic figure skating. And, like many people, it was there that I first encountered Alysa Liu. Her graceful, fierce, effortless, irreverent skating was occasionally punctuated by a <em>'That's what I'm fucking talking about!'</em> People whose vitality overflows like hers are rare, especially in an age when everything is being smoothed down and sterilized.</p><p dir=""ltr"">Watching these two people reignites something that everything else seems conspiring to extinguish. That force which drives you to paint on a larger canvas, to fight back against the grey dailiness.</p><p dir=""ltr"">'Whatever your hand finds to do, do it with all your might; for there is no activity or planning or knowledge or wisdom in Sheol where you are going.' Ecclesiastes 9:10</p>","","","","","","","","",""
"mektoub-my-love-en","Arts - English","Mektoub, My Love","These three hours felt like a long month of August, where everything is so slow but also passes so quickly.","FILM REVIEW","Raphaël Touzelet","/entries/articles/mektoub-my-love-fr","2026-03-08T00:00:00.000Z","https://framerusercontent.com/images/TRm6FXxT93fvqSiHDv22ooCFWoY.png","","NO","<p dir=""auto"">Sublime, everything is sublime. From the very first scene I was captivated: that conversation between Amin and Ophélie, and in a single scene Kechiche announces all his talent for what will make up the bulk of the film: dialogue. You feel that nothing is written; the characters talk about trivial things, they fill the void, there are awkward silences, repetitions, the actors even correct their own pronunciation. This is one of the film's three facets: realism.</p><p dir=""auto"">I don't know how it's possible to get acting this natural. The timing of the laughs, the smiles, the lines can't be calculated or rehearsed; everything is pure improvisation, pure life. Kechiche chose around thirty people to spend a vacation together and turned it into a film of pure, real moments.</p><p dir=""auto"">I really appreciated the way the film gives genuine importance to every character. Sure, Amin is the 'main' character simply because we see everything through his eyes, but he matters no more to the story than Charlotte, Ophélie, or Céline.</p><p dir=""auto"">Because yes, this is a film that films bodies, and that's its second facet: desire. The actors in the film are all beautiful to look at. Sensuality passes through looks: all it takes is a slightly lingering glance between Ophélie and Amin followed by a small, embarrassed laugh for us to understand everything.</p><p dir=""auto"">Finally, and this is the facet that gives the film its full depth: grace. It's a film touched by a mystical beauty. The film is filled with clearly religious images, drawn from both Catholicism and Islam. And then there are the sheep. The scenes on Ophélie's farm are among my favorites.</p><p dir=""auto"">But amid all this beauty, real and mystical, tender and erotic, there is pain. A real wound, and it belongs to Amin. He looks lovingly at Ophélie as she neglects him, and turns away every girl who desires him so openly. He is alone, in the middle of golden beaches.</p><p dir=""auto"">If <em>Mektoub, My Love</em> is a great film, it's also thanks to its editing. These three hours feel exactly like a long month of August, where everything is slow, yet everything passes so quickly. And in the end, all that remains are a few beautiful memories, and many regrets.</p>","","","","","","","","",""
